{
  "artifact": "LOCUS-version-registry-v1",
  "namespace": "LOCUS",
  "protected_identifiers": [
    "LOCUS-account-scoped-bootstrap-v1",
    "LOCUS-admission-binding-v1",
    "LOCUS-admission-capability-v1",
    "LOCUS-admission-client-proof-v1",
    "LOCUS-admission-replay-v1",
    "LOCUS-AES-256-GCM-v0",
    "LOCUS-AES-256-GCM-v1",
    "LOCUS-anonymous-artifact-v1",
    "LOCUS-anonymous-artifact-v2",
    "LOCUS-application-storage-gateway-v1",
    "LOCUS-application-storage-gateway-v2",
    "LOCUS-APPSS-2HASHDH-RISTRETTO255-SHA512-GF128-v1",
    "LOCUS-APPSS-2of3-v1",
    "LOCUS-APPSS-3of5-v1",
    "LOCUS-APPSS-client-session-v1",
    "LOCUS-APPSS-client-session-v2",
    "LOCUS-APPSS-format-vectors-v1",
    "LOCUS-APPSS-format-vectors-v2",
    "LOCUS-APPSS-OPRF-RISTRETTO255-SHA512-v1",
    "LOCUS-APPSS-party-state-v1",
    "LOCUS-APPSS-party-state-v2",
    "LOCUS-APPSS-password-input-v1",
    "LOCUS-APPSS-pending-party-state-v1",
    "LOCUS-APPSS-pending-party-state-v2",
    "LOCUS-APPSS-public-state-v1",
    "LOCUS-APPSS-public-state-v2",
    "LOCUS-APPSS-request-v1",
    "LOCUS-APPSS-request-v2",
    "LOCUS-APPSS-response-v1",
    "LOCUS-APPSS-response-v2",
    "LOCUS-APPSS-state-install-v1",
    "LOCUS-APPSS-state-install-v2",
    "LOCUS-APPSS-state-ready-v1",
    "LOCUS-APPSS-state-ready-v2",
    "LOCUS-APPSS-wire-v1",
    "LOCUS-APPSS-wire-v2",
    "LOCUS-attack-report-v1",
    "LOCUS-attempt-config-v2",
    "LOCUS-attempt-entry-v1",
    "LOCUS-attempt-model-report-v1",
    "LOCUS-authenticated-enrollment-transport-v1",
    "LOCUS-authorization-certificate-v1",
    "LOCUS-backup-associated-data-v1",
    "LOCUS-backup-associated-data-v2",
    "LOCUS-backup-associated-data-v3",
    "LOCUS-backup-digest-v1",
    "LOCUS-bootstrap-signature-v1",
    "LOCUS-bootstrap-trust-config-v1",
    "LOCUS-canonical-email-set-v1",
    "LOCUS-canonical-phone-set-v1",
    "LOCUS-clean-client-isolation-v1",
    "LOCUS-clean-client-isolation-v2",
    "LOCUS-client-api-v1",
    "LOCUS-client-api-v2",
    "LOCUS-client-recovery-package-v1",
    "LOCUS-cloud-backup-object-v1",
    "LOCUS-cloud-backup-object-v2",
    "LOCUS-cloud-backup-reference-v1",
    "LOCUS-cloud-snapshot-input-v1",
    "LOCUS-combined-snapshot-input-v1",
    "LOCUS-compose-benchmark-v1",
    "LOCUS-compose-deployment-v2",
    "LOCUS-compose-performance-result-v1",
    "LOCUS-compose-profile-evidence-v1",
    "LOCUS-compose-recovery-v1",
    "LOCUS-compose-recovery-v2",
    "LOCUS-container-controller-api-v1",
    "LOCUS-cue-policy-conformance-v1",
    "LOCUS-cue-policy-corpus-v1",
    "LOCUS-descriptor-bundle-store-v1",
    "LOCUS-descriptor-current-pointer-v1",
    "LOCUS-descriptor-security-scenarios-v1",
    "LOCUS-deterministic-directory-v1",
    "LOCUS-deterministic-directory-v2",
    "LOCUS-deterministic-fixture-v1",
    "LOCUS-development-backup-v1",
    "LOCUS-development-context-v1",
    "LOCUS-entry-vote-v1",
    "LOCUS-epoch-activation-certificate-v1",
    "LOCUS-epoch-approval-v1",
    "LOCUS-epoch-lifecycle-policy-v1",
    "LOCUS-epoch-ready-v2",
    "LOCUS-epoch-transition-v1",
    "LOCUS-experiment-metadata-v1",
    "LOCUS-improvement-portable-contents-v4",
    "LOCUS-in-process-walkthrough-v1",
    "LOCUS-install-vote-v1",
    "LOCUS-integrated-manager-config-v1",
    "LOCUS-integrated-manager-deployment-v1",
    "LOCUS-integrated-reference-config-v1",
    "LOCUS-integrated-reference-deployment-v1",
    "LOCUS-loc-id-v1",
    "LOCUS-local-container-controller-v1",
    "LOCUS-local-context-v0",
    "LOCUS-local-context-v1",
    "LOCUS-local-manager-ui-v1",
    "LOCUS-local-research-ui-v1",
    "LOCUS-local-synthetic-admission-v1",
    "LOCUS-location-person-pair-v1",
    "LOCUS-location-person-set-v1",
    "LOCUS-managed-client-instance-v1",
    "LOCUS-managed-client-ui-v1",
    "LOCUS-managed-state-corpus-manifest-v1",
    "LOCUS-managed-state-evidence-profile-v1",
    "LOCUS-managed-state-result-appss-v1",
    "LOCUS-managed-state-result-common-v1",
    "LOCUS-managed-state-result-yi-v1",
    "LOCUS-managed-state-scenario-manifest-v1",
    "LOCUS-manager-api-v1",
    "LOCUS-no-resolver-v1",
    "LOCUS-paired-suite-deployment-2of3-v1",
    "LOCUS-paired-suite-deployment-3of5-v1",
    "LOCUS-party-current-signature-v1",
    "LOCUS-party-current-summary-v1",
    "LOCUS-party-endpoint-setup-v1",
    "LOCUS-party-service-config-v1",
    "LOCUS-party-service-config-v2",
    "LOCUS-party-snapshot-input-v1",
    "LOCUS-performance-client-samples-v1",
    "LOCUS-performance-latex-rows-v1",
    "LOCUS-performance-paper-inputs-v1",
    "LOCUS-performance-paper-inputs-v2",
    "LOCUS-performance-processed-v1",
    "LOCUS-performance-processed-v2",
    "LOCUS-person-id-v1",
    "LOCUS-prepare-certificate-v1",
    "LOCUS-profile-trace-policy-v1",
    "LOCUS-provision-metric-v1",
    "LOCUS-quantized-coordinate-set-v1",
    "LOCUS-recovery-bundle-manifest-v1",
    "LOCUS-recovery-bundle-v1",
    "LOCUS-recovery-configuration-v1",
    "LOCUS-recovery-descriptor-v1",
    "LOCUS-recovery-receipt-v1",
    "LOCUS-recovery-suite-compromise-regression-v1",
    "LOCUS-recovery-suite-selector-v1",
    "LOCUS-recovery-suite-selector-v2",
    "LOCUS-reference-backup-v3",
    "LOCUS-reference-backup-v4",
    "LOCUS-reference-backup-v5",
    "LOCUS-reference-backup-v6",
    "LOCUS-reference-group-secret-v1",
    "LOCUS-reference-party-v1",
    "LOCUS-resolver-drift-corpus-v1",
    "LOCUS-resolver-fixture-v1",
    "LOCUS-response-freshness-certificate-v1",
    "LOCUS-response-freshness-request-v1",
    "LOCUS-response-freshness-vote-v1",
    "LOCUS-runtime-epoch-package-v1",
    "LOCUS-security-matrix-v1",
    "LOCUS-security-matrix-v2",
    "LOCUS-security-policy-v0",
    "LOCUS-security-policy-v1",
    "LOCUS-storage-metric-v1",
    "LOCUS-storage-pointer-cas-v1",
    "LOCUS-storage-provider-aws-s3-v1",
    "LOCUS-storage-provider-filesystem-v1",
    "LOCUS-storage-provider-profile-v1",
    "LOCUS-storage-provider-s3-compatible-v1",
    "LOCUS-successor-publication-journal-v1",
    "LOCUS-synthetic-combined-candidate-alpha-v1",
    "LOCUS-synthetic-combined-candidate-beta-v1",
    "LOCUS-synthetic-offline-candidate-alpha-v1",
    "LOCUS-synthetic-offline-candidate-beta-v1",
    "LOCUS-synthetic-party-candidate-alpha-v1",
    "LOCUS-synthetic-party-candidate-beta-v1",
    "LOCUS-TPASS-wire-v1",
    "LOCUS-TPASS-YI-2of3-v1",
    "LOCUS-TPASS-YI-3of5-v1",
    "LOCUS-TPASS-YI-ZK-RISTRETTO255-v1",
    "LOCUS-version-registry-v1"
  ],
  "reservations": [
    {
      "family": "admission",
      "allocation_phase": "P3.3",
      "decisions": [
        "D004",
        "D015"
      ],
      "required_gate": "Approve the strict capability schema, proof-key and replay bindings, canonical vectors, and local issuer/verifier profile.",
      "compatibility_rule": "The provider-neutral contract and every optional provider adapter use distinct identifiers; admission never changes CuePolicy or recovery-suite bytes."
    },
    {
      "family": "artifact",
      "allocation_phase": "P10.3",
      "decisions": [
        "D018",
        "D025"
      ],
      "required_gate": "After P7.7/P8/P9, approve the revised portable-artifact manifest, managed-system allowlist, provenance rules, Manager/Client reviewer workflow, and deterministic package tests.",
      "compatibility_rule": "Frozen anonymous-artifact v1 and v2 packages remain immutable; the later D025 implementation and evidence are packaged under a new artifact identifier."
    },
    {
      "family": "backup-and-bundle",
      "allocation_phase": "P2.1",
      "decisions": [
        "D001",
        "D014",
        "D015",
        "D025"
      ],
      "required_gate": "P2.1 v1 allocation required the descriptor, current-pointer, bundle, manifest, trust, limit, and suite-binding profiles with bounded canonical vectors. P7.7 assigned the additive D025 client recovery-package after its schema, limits, vector, strict decoder, authenticated import checks, and negative tests passed.",
      "compatibility_rule": "The client recovery package is an additive transport and cannot reinterpret enclosed backup, descriptor, bundle, pointer, receipt, or cloud-object bytes; any changed enclosed semantics require their own new epoch and identifier."
    },
    {
      "family": "deployment",
      "allocation_phase": "P6.3",
      "decisions": [
        "D008",
        "D015",
        "D017",
        "D018"
      ],
      "required_gate": "Freeze exact suite, topology, authorization quorum, host scope, provider, runtime package, and test matrix.",
      "compatibility_rule": "Same-host, host-separated, independently administered, provider, suite, and threshold profiles are never pooled or relabeled."
    },
    {
      "family": "descriptor",
      "allocation_phase": "P2.1",
      "decisions": [
        "D001",
        "D003",
        "D014"
      ],
      "required_gate": "P2.1 v1 allocation required strict RecoveryDescriptor and authenticated current-pointer schemas, external trust-root rules, limits, signatures, and canonical vectors; every later semantic change repeats that gate.",
      "compatibility_rule": "A descriptor version binds one suite and epoch and never changes frozen backup, CuePolicy, or Yi formats."
    },
    {
      "family": "integrated-reference-deployment",
      "allocation_phase": "P7.5",
      "decisions": [
        "D004",
        "D008",
        "D009",
        "D015",
        "D017",
        "D018",
        "D021",
        "D022",
        "D023",
        "D025"
      ],
      "required_gate": "P7.5 assigned the D023 reference family. P7.7 assigned all twelve D025 managed profiles after strict schemas, vectors, compatibility rules, negative tests, exact internal/edge-network membership, volatile Client reset and credential/reset checks, focused validation, and the complete managed smoke passed.",